{
  "report_version": "1.0.0",
  "status": "invalid",
  "validation_id": "fixture_semantic_mismatch",
  "source": {
    "kind": "workflow_graph",
    "id": "semantic_mismatch_demo",
    "digest": "sha256:0000000000000000000000000000000000000000000000000000000000000000"
  },
  "summary": {
    "error_count": 1,
    "warning_count": 0
  },
  "diagnostics": [
    {
      "code": "WG013",
      "stage": "type",
      "severity": "error",
      "message": "Semantic type mismatch: bio.bam.aligned -> bio.bam.sorted",
      "path": "/edges/0",
      "location": {
        "node_id": "samtools_index_1",
        "edge_id": "edge_bam_to_index",
        "port": "bam"
      },
      "context": {
        "source_type": "bio.bam.aligned",
        "target_type": "bio.bam.sorted"
      },
      "suggestion": "Connect a tool output with semantic type bio.bam.sorted."
    }
  ]
}
